{
  "schema_version": "pm.semantics/v1",
  "connector_id": "postgres",
  "source_digest": "sha256:25952582914c648a0d0f193f07679f41cd15c8e7ced92d34ee0bd2a55ac176f2",
  "revision": "sha256:91463ecb00fd9997f04b1131abab41e7a00d2c1df9b574baabdcfb70e82a4030",
  "operations": [
    {
      "operation_id": "relation/metadata",
      "source_refs": [
        {
          "source_id": "postgresql-16-protocol",
          "pointer": "#PROTOCOL"
        },
        {
          "source_id": "postgresql-16-information-schema",
          "pointer": "#INFORMATION-SCHEMA"
        },
        {
          "source_id": "postgresql-16-infoschema-columns",
          "pointer": "#INFOSCHEMA-COLUMNS"
        }
      ],
      "lanes": [
        {
          "lane": "direct_read",
          "classification": "eligible",
          "reason": "the declared metadata statement reads one live relation's column names and types over the native protocol, so an authorized bounded relation read is reachable",
          "source_refs": [
            {
              "source_id": "postgresql-16-infoschema-columns",
              "pointer": "#INFOSCHEMA-COLUMNS"
            },
            {
              "source_id": "postgresql-16-information-schema",
              "pointer": "#INFORMATION-SCHEMA"
            }
          ]
        },
        {
          "lane": "direct_write",
          "classification": "not_applicable",
          "reason": "the metadata statement takes no mapped input and performs no destination mutation",
          "source_refs": [
            {
              "source_id": "postgresql-16-information-schema",
              "pointer": "#INFORMATION-SCHEMA"
            }
          ]
        },
        {
          "lane": "etl",
          "classification": "unproven",
          "reason": "extraction into a checkpointed destination is not admitted in this slice; the statement inspects exactly one relation",
          "source_refs": [
            {
              "source_id": "postgresql-16-infoschema-columns",
              "pointer": "#INFOSCHEMA-COLUMNS"
            }
          ]
        },
        {
          "lane": "reverse_etl",
          "classification": "not_applicable",
          "reason": "the operation declares no destination mapping, workset or writable column",
          "source_refs": [
            {
              "source_id": "postgresql-16-information-schema",
              "pointer": "#INFORMATION-SCHEMA"
            }
          ]
        },
        {
          "lane": "binary_download",
          "classification": "not_applicable",
          "reason": "the declared response is a typed JSON row envelope with no binary media type",
          "source_refs": [
            {
              "source_id": "postgresql-16-infoschema-columns",
              "pointer": "#INFOSCHEMA-COLUMNS"
            }
          ]
        },
        {
          "lane": "binary_upload",
          "classification": "not_applicable",
          "reason": "the operation declares no request body and no binary media type",
          "source_refs": [
            {
              "source_id": "postgresql-16-protocol",
              "pointer": "#PROTOCOL"
            }
          ]
        },
        {
          "lane": "sync_transport",
          "classification": "unproven",
          "reason": "scheduled transport with cadence, deduplication and checkpoint semantics is not implemented in this slice; PostgreSQL logical CDC remains deferred",
          "source_refs": [
            {
              "source_id": "postgresql-16-protocol",
              "pointer": "#PROTOCOL"
            }
          ]
        }
      ]
    },
    {
      "operation_id": "relation/select",
      "source_refs": [
        {
          "source_id": "postgresql-16-protocol",
          "pointer": "#PROTOCOL"
        },
        {
          "source_id": "postgresql-16-protocol-flow",
          "pointer": "#PROTOCOL-FLOW-EXT-QUERY"
        },
        {
          "source_id": "postgresql-16-sql-select",
          "pointer": "#SQL-SELECT"
        },
        {
          "source_id": "postgresql-16-sql-select",
          "pointer": "#SQL-WHERE"
        },
        {
          "source_id": "postgresql-16-sql-select",
          "pointer": "#SQL-LIMIT"
        },
        {
          "source_id": "postgresql-16-sql-select",
          "pointer": "#SQL-ORDERBY"
        }
      ],
      "lanes": [
        {
          "lane": "direct_read",
          "classification": "eligible",
          "reason": "bounded keyed select over declared columns with an explicit row bound, positional parameters and a deterministic order",
          "source_refs": [
            {
              "source_id": "postgresql-16-sql-select",
              "pointer": "#SQL-SELECT"
            },
            {
              "source_id": "postgresql-16-sql-select",
              "pointer": "#SQL-WHERE"
            },
            {
              "source_id": "postgresql-16-sql-select",
              "pointer": "#SQL-LIMIT"
            },
            {
              "source_id": "postgresql-16-sql-select",
              "pointer": "#SQL-ORDERBY"
            },
            {
              "source_id": "postgresql-16-protocol-flow",
              "pointer": "#PROTOCOL-FLOW-EXT-QUERY"
            }
          ]
        },
        {
          "lane": "direct_write",
          "classification": "not_applicable",
          "reason": "the select statement performs no destination mutation",
          "source_refs": [
            {
              "source_id": "postgresql-16-sql-select",
              "pointer": "#SQL-SELECT"
            }
          ]
        },
        {
          "lane": "etl",
          "classification": "unproven",
          "reason": "the operation can supply bounded typed rows, but this slice admits no accepted ETL checkpoint or warehouse publication path",
          "source_refs": [
            {
              "source_id": "postgresql-16-sql-select",
              "pointer": "#SQL-SELECT"
            },
            {
              "source_id": "postgresql-16-sql-select",
              "pointer": "#SQL-LIMIT"
            }
          ]
        },
        {
          "lane": "reverse_etl",
          "classification": "not_applicable",
          "reason": "the accepted operation declares no destination mapping or provider write, which reverse ETL requires",
          "source_refs": [
            {
              "source_id": "postgresql-16-sql-select",
              "pointer": "#SQL-SELECT"
            }
          ]
        },
        {
          "lane": "binary_download",
          "classification": "not_applicable",
          "reason": "every declared response media type is a typed JSON row envelope; no binary media type is declared",
          "source_refs": [
            {
              "source_id": "postgresql-16-sql-select",
              "pointer": "#SQL-SELECT"
            }
          ]
        },
        {
          "lane": "binary_upload",
          "classification": "not_applicable",
          "reason": "the accepted operation declares no request body and no binary media type",
          "source_refs": [
            {
              "source_id": "postgresql-16-protocol",
              "pointer": "#PROTOCOL"
            }
          ]
        },
        {
          "lane": "sync_transport",
          "classification": "unproven",
          "reason": "durable scheduled transport with cadence, deduplication and checkpoint semantics is not implemented in this slice",
          "source_refs": [
            {
              "source_id": "postgresql-16-protocol",
              "pointer": "#PROTOCOL"
            },
            {
              "source_id": "postgresql-16-protocol-flow",
              "pointer": "#PROTOCOL-FLOW-EXT-QUERY"
            }
          ]
        }
      ]
    },
    {
      "operation_id": "relation/mapped-upsert",
      "source_refs": [
        {
          "source_id": "postgresql-16-protocol",
          "pointer": "#PROTOCOL"
        },
        {
          "source_id": "postgresql-16-protocol-flow",
          "pointer": "#PROTOCOL-FLOW-EXT-QUERY"
        },
        {
          "source_id": "postgresql-16-sql-insert",
          "pointer": "#SQL-INSERT"
        },
        {
          "source_id": "postgresql-16-sql-insert",
          "pointer": "#SQL-ON-CONFLICT"
        },
        {
          "source_id": "postgresql-16-sql-update",
          "pointer": "#SQL-UPDATE"
        }
      ],
      "lanes": [
        {
          "lane": "direct_read",
          "classification": "not_applicable",
          "reason": "the mapped insert-or-update is a destination mutation; its typed row projection reports its own effects, not a read of provider state",
          "source_refs": [
            {
              "source_id": "postgresql-16-sql-insert",
              "pointer": "#SQL-INSERT"
            }
          ]
        },
        {
          "lane": "direct_write",
          "classification": "eligible",
          "reason": "declared mapped insert-or-update over one relation with a stable unique key, approved writable-column mappings, changed-value-only assignment and unchanged-value suppression",
          "source_refs": [
            {
              "source_id": "postgresql-16-sql-insert",
              "pointer": "#SQL-INSERT"
            },
            {
              "source_id": "postgresql-16-sql-insert",
              "pointer": "#SQL-ON-CONFLICT"
            },
            {
              "source_id": "postgresql-16-sql-update",
              "pointer": "#SQL-UPDATE"
            }
          ]
        },
        {
          "lane": "etl",
          "classification": "not_applicable",
          "reason": "the operation writes one destination relation and declares no checkpointed extraction",
          "source_refs": [
            {
              "source_id": "postgresql-16-sql-insert",
              "pointer": "#SQL-INSERT"
            }
          ]
        },
        {
          "lane": "reverse_etl",